strategy,evidence_position,India_relevance,implementation_gap
Pesticide exposure reduction,Strong prevention relevance,Agricultural/occupational surveillance; PPE; substitution of high-risk compounds,Policy and exposure measurement gaps
Physical activity promotion,High feasibility,Primary care and NCD clinic prescription; community programs,Need PD-specific prevention trials
Air pollution mitigation,Suggestive PD-specific evidence; strong general health rationale,Urban/rural air-quality policy and risk communication,Individual-level exposure attribution difficult
Head injury prevention,Suggestive,"Road safety, workplace protection, fall prevention",PD-specific effect sizes uncertain
Metabolic risk management,Mechanistically plausible,Diabetes/NCD platforms; lifestyle and approved metabolic care,GLP-1 PD indication not established
Diet quality,Suggestive,"Affordable Mediterranean/MIND-adapted patterns; pulses, vegetables, nuts when feasible",Cultural and cost adaptation required
